,Unnamed: 0,desc,docurl,filedate,path,ticker,filename,Symbol,Security,SEC filings,GICS Sector,GICS Sub Industry,Headquarters Location,Date first added[3][4],CIK,Founded,Results
241,241,0001004434-18-000009,/Archives/edgar/data/1004434/000100443418000009/0001004434-18-000009-index.htm,3/29/2018,https://www.sec.gov/Archives/edgar/data/1004434/000100443418000009/0001004434-18-000009.txt,AMG,AMG_2018-03-29_0001004434-18-000009.txt,AMG,Affiliated Managers Group Inc,reports,Financials,Asset Management & Custody Banks,"Beverly, Massachusetts",41821,1004434,1993,[]
242,242,0001004434-18-000004,/Archives/edgar/data/1004434/000100443418000004/0001004434-18-000004-index.htm,2/23/2018,https://www.sec.gov/Archives/edgar/data/1004434/000100443418000004/0001004434-18-000004.txt,AMG,AMG_2018-02-23_0001004434-18-000004.txt,AMG,Affiliated Managers Group Inc,reports,Financials,Asset Management & Custody Banks,"Beverly, Massachusetts",41821,1004434,1993,"['Between 1997 and 1998, the levels of unemployment in these states as a whole fell by approximately .', 'Employees As of December 31, 1998, there were 170,975 full-time equivalent employees within the Corporation and its subsidiaries.', 'Of the foregoing employees, 90,029 were employed within Consumer Banking, 5,196 were employed within Commercial Banking, 11,758 were employed within Global Corporate and Investment Banking, and 7,109 were employed within Principal Investing and Wealth Management.', 'Approximately 5,000 non-officer employees in the State of Washington are covered by a collective bargaining agreement.', 'o Asset management and fiduciary service fees decreased $17 million in 1998, reflecting the impact of the third quarter 1997 sales of certain corporate and institutional trust businesses, which included businesses that provided administrative and record-keeping services for employee benefit plans.', 'On December 31, 1998, the Corporation had approximately 171,000 full-time equivalent employees compared to approximately 181,000 full-time equivalent employees on December 31, 1997.', '-- 125 (101) -- 24 Other merger costs ..................... -- 100 (99) -- 1 \\--- ---- ------ ------ ---- $-- $900 $ (526) $ (247) $127 === ==== ====== ====== ====  Total severance, change in control and other employee-related costs for both mergers included amounts related to job eliminations, primarily in areas of overlapping operations and duplicate functions.', 'Through December 31, 1998, approximately 1,700 employees have entered the severance process as result of the Barnett merger.', ""1996 Associates Stock Option Award Plan: Under the 1996 Associates Stock Option Award Plan (ASOP), as amended, the Corporation has granted to certain full- and part-time employees options to purchase an aggregate of approximately 47 million shares of the Corporation's common stock."", '2 million shares of common stock have been granted through December 31, 1998 to certain employees at the closing market price on the respective grant dates.', ""Effective May 22, 1997, BankAmerica adopted PEP under which BankAmerica offers shares of the Corporation's common stock to certain key employees."", 'Effective October 1, 1996, BankAmerica adopted The BankAmerica Global Stock Option Program which covered substantially all of its employees.']"
243,243,0001004434-17-000007,/Archives/edgar/data/1004434/000100443417000007/0001004434-17-000007-index.htm,3/31/2017,https://www.sec.gov/Archives/edgar/data/1004434/000100443417000007/0001004434-17-000007.txt,AMG,AMG_2017-03-31_0001004434-17-000007.txt,AMG,Affiliated Managers Group Inc,reports,Financials,Asset Management & Custody Banks,"Beverly, Massachusetts",41821,1004434,1993,"['Between 1996 and 1997, the levels of unemployment in these regions as a whole fell by approximately .', '5  Employees As of December 31, 1997, the Corporation and its subsidiaries had 80,360 full-time equivalent employees.', 'Of the foregoing employees, 48,998 were employed by the General Bank, 6,882 were employed by Global Finance, 2,768 were employed by Financial Services, 19,416 were employed by NationsBanc Services, Inc. (a subsidiary providing operational support services to the Corporation and its subsidiaries) and the remainder were employed by the Corporation and its other subsidiaries.', 'On January 9, 1998, the Corporation completed its merger with Barnett Banks, Inc., which had 21,487 full-time equivalent employees as of December 31, 1997.', ""Assets under management and administration in 1997 were impacted by the Boatmen's acquisition and the third quarter 1997 sales of certain corporate and institutional trust businesses, which included businesses that provided administrative and record-keeping services for employee benefit plans."", 'On December 31, 1997, the Corporation had approximately 80,000 full-time equivalent employees compared to approximately 63,000 full-time equivalent employees on December 31, 1996.', ""Excluding the impact of the Boatmen's and Montgomery acquisitions, full-time equivalent employees at December 31, 1997 were essentially unchanged compared to December 31, 1996 levels."", '(15) (15) Common stock issued under employee plans ......... 3,456 109 27 136 Stock issued in acquisitions ..................... 73 55,436 586 192 2 853 Common stock repurchased .........................', '(11) (11) Common stock issued under employee plans ......... 27,725 1,255 (13) 1,242 Stock issued in acquisitions ..................... 82 202,966 9,746 9,828 Common stock repurchased .........................', ""1996 Associates Stock Option Award Plan: Under the 1996 Associates Stock Option Award Plan (ASOP), as amended, the Corporation has granted to certain full- and part-time employees options to purchase an aggregate of approximately 47 million shares of the Corporation's common stock."", 'On February 2, 1998, ten-year options to purchase approximately 900 thousand shares of common stock at $61 7/16 per share were granted to certain employees.', '3 million shares of restricted stock and ten-year options to purchase 495 thousand shares of common stock were granted to certain former Barnett executives in connection with their employment with the Corporation.']"
244,244,0001004434-17-000004,/Archives/edgar/data/1004434/000100443417000004/0001004434-17-000004-index.htm,2/24/2017,https://www.sec.gov/Archives/edgar/data/1004434/000100443417000004/0001004434-17-000004.txt,AMG,AMG_2017-02-24_0001004434-17-000004.txt,AMG,Affiliated Managers Group Inc,reports,Financials,Asset Management & Custody Banks,"Beverly, Massachusetts",41821,1004434,1993,"['Between 1995 and 1996, the levels of unemployment in these regions as a whole fell by approximately .', 'EMPLOYEES As of December 31, 1996, the registrant and its subsidiaries had 62,971 full-time equivalent employees.', ""Of the foregoing employees, 35,766 were employed by the General Bank, 5,178 were employed by Global Finance, 3,129 were employed by Financial Services, 14,815 were employed by NationsBanc Services, Inc. (a subsidiary providing operational support services to the registrant and its subsidiaries) and the remainder were employed by the registrant holding company and the registrant's other subsidiaries."", 'As of December 31, 1996, BBI and its subsidiaries had 19,028 full-time equivalent employees.']"
245,245,0001004434-16-000038,/Archives/edgar/data/1004434/000100443416000038/0001004434-16-000038-index.htm,3/30/2016,https://www.sec.gov/Archives/edgar/data/1004434/000100443416000038/0001004434-16-000038.txt,AMG,AMG_2016-03-30_0001004434-16-000038.txt,AMG,Affiliated Managers Group Inc,reports,Financials,Asset Management & Custody Banks,"Beverly, Massachusetts",41821,1004434,1993,"[""The acquired assets included primarily a $25 billion residential mortgage servicing portfolio, for which the registrant's subsidiary paid approximately $339 million, and a mortgage servicing operation employing about 430 people and other servicing-related assets, for which this subsidiary paid approximately $150 million."", 'EMPLOYEES At December 31, 1995, the registrant and its subsidiaries had 58,322 full-time equivalent employees.', ""Of the foregoing employees, 32,763 were employed by the General Bank, 5,429 were employed by Global Finance, 2,744 were employed by Financial Services, 13,300 were employed by NationsBanc Services, Inc. (a subsidiary providing operational support services to the registrant and its subsidiaries) and the remainder were employed by the registrant holding company and the registrant's other subsidiaries.""]"
246,246,0001004434-16-000035,/Archives/edgar/data/1004434/000100443416000035/0001004434-16-000035-index.htm,2/25/2016,https://www.sec.gov/Archives/edgar/data/1004434/000100443416000035/0001004434-16-000035.txt,AMG,AMG_2016-02-25_0001004434-16-000035.txt,AMG,Affiliated Managers Group Inc,reports,Financials,Asset Management & Custody Banks,"Beverly, Massachusetts",41821,1004434,1993,"['EMPLOYEES At December 31, 1994, the registrant and its subsidiaries had 61,484 full time equivalent employees.', ""Of the foregoing employees, 35,401 were employed by the General Bank, 5,199 were employed by the Global Finance Group, 2,643 were employed by the Financial Services Group, 13,860 were employed by NationsBanc Services, Inc. (a subsidiary providing operational support services to the registrant and its subsidiaries) and the remainder were employed by the registrant holding company and the registrant's other banking and operating subsidiaries.""]"
247,247,0001004434-15-000008,/Archives/edgar/data/1004434/000100443415000008/0001004434-15-000008-index.htm,3/31/2015,https://www.sec.gov/Archives/edgar/data/1004434/000100443415000008/0001004434-15-000008.txt,AMG,AMG_2015-03-31_0001004434-15-000008.txt,AMG,Affiliated Managers Group Inc,reports,Financials,Asset Management & Custody Banks,"Beverly, Massachusetts",41821,1004434,1993,"['EMPLOYEES At December 31, 1993, the registrant and its subsidiaries had 57,463 full time equivalent employees.']"
248,248,0001004434-15-000003,/Archives/edgar/data/1004434/000100443415000003/0001004434-15-000003-index.htm,2/23/2015,https://www.sec.gov/Archives/edgar/data/1004434/000100443415000003/0001004434-15-000003.txt,AMG,AMG_2015-02-23_0001004434-15-000003.txt,AMG,Affiliated Managers Group Inc,reports,Financials,Asset Management & Custody Banks,"Beverly, Massachusetts",41821,1004434,1993,"['31, 2017, BNY Mellon and its subsidiaries had approximately 52,500 full-time employees.']"
249,249,0001004434-14-000009,/Archives/edgar/data/1004434/000100443414000009/0001004434-14-000009-index.htm,3/31/2014,https://www.sec.gov/Archives/edgar/data/1004434/000100443414000009/0001004434-14-000009.txt,AMG,AMG_2014-03-31_0001004434-14-000009.txt,AMG,Affiliated Managers Group Inc,reports,Financials,Asset Management & Custody Banks,"Beverly, Massachusetts",41821,1004434,1993,"['31, 2016, BNY Mellon and its subsidiaries had approximately 52,000 full-time employees.']"
250,250,0001004434-14-000006,/Archives/edgar/data/1004434/000100443414000006/0001004434-14-000006-index.htm,2/27/2014,https://www.sec.gov/Archives/edgar/data/1004434/000100443414000006/0001004434-14-000006.txt,AMG,AMG_2014-02-27_0001004434-14-000006.txt,AMG,Affiliated Managers Group Inc,reports,Financials,Asset Management & Custody Banks,"Beverly, Massachusetts",41821,1004434,1993,"['31, 2015, BNY Mellon and its subsidiaries had approximately 51,200 full-time employees.']"
251,251,0001047469-13-001515,/Archives/edgar/data/1004434/000104746913001515/0001047469-13-001515-index.htm,2/22/2013,https://www.sec.gov/Archives/edgar/data/1004434/000104746913001515/0001047469-13-001515.txt,AMG,AMG_2013-02-22_0001047469-13-001515.txt,AMG,Affiliated Managers Group Inc,reports,Financials,Asset Management & Custody Banks,"Beverly, Massachusetts",41821,1004434,1993,"['31, 2014, BNY Mellon and its subsidiaries had approximately 50,300 employees.']"
252,252,0001047469-12-001372,/Archives/edgar/data/1004434/000104746912001372/0001047469-12-001372-index.htm,2/23/2012,https://www.sec.gov/Archives/edgar/data/1004434/000104746912001372/0001047469-12-001372.txt,AMG,AMG_2012-02-23_0001047469-12-001372.txt,AMG,Affiliated Managers Group Inc,reports,Financials,Asset Management & Custody Banks,"Beverly, Massachusetts",41821,1004434,1993,"['31, 2013, BNY Mellon and its subsidiaries had approximately 51,100 employees.']"
253,253,0001047469-11-001624,/Archives/edgar/data/1004434/000104746911001624/0001047469-11-001624-index.htm,3/1/2011,https://www.sec.gov/Archives/edgar/data/1004434/000104746911001624/0001047469-11-001624.txt,AMG,AMG_2011-03-01_0001047469-11-001624.txt,AMG,Affiliated Managers Group Inc,reports,Financials,Asset Management & Custody Banks,"Beverly, Massachusetts",41821,1004434,1993,[]
254,254,0001104659-10-017670,/Archives/edgar/data/1004434/000110465910017670/0001104659-10-017670-index.htm,3/31/2010,https://www.sec.gov/Archives/edgar/data/1004434/000110465910017670/0001104659-10-017670.txt,AMG,AMG_2010-03-31_0001104659-10-017670.txt,AMG,Affiliated Managers Group Inc,reports,Financials,Asset Management & Custody Banks,"Beverly, Massachusetts",41821,1004434,1993,"['31, 2012, BNY Mellon and its subsidiaries had approximately 49,500 employees.']"
255,255,0001047469-10-001655,/Archives/edgar/data/1004434/000104746910001655/0001047469-10-001655-index.htm,3/1/2010,https://www.sec.gov/Archives/edgar/data/1004434/000104746910001655/0001047469-10-001655.txt,AMG,AMG_2010-03-01_0001047469-10-001655.txt,AMG,Affiliated Managers Group Inc,reports,Financials,Asset Management & Custody Banks,"Beverly, Massachusetts",41821,1004434,1993,"['Disciplinary powers include the power to temporarily or permanently revoke the authorization to carry on regulated business following a breach of U.K. Financial Services and Markets Act 2000 (\x93FSMA 2000\x94) and/or regulatory rules, the suspension of registered employees and censures and fines for both regulated businesses and their registered employees.', '31, 2011, BNY Mellon and its subsidiaries had approximately 48,700 employees.', '57* |    | Description regarding amendments entered into on December 22, 2006 by Robert P. Kelly and Mellon Financial Corporation to his Change in Control Severance Agreement, employment letter agreement and equity award agreement.']"
256,256,0001104659-09-021798,/Archives/edgar/data/1004434/000110465909021798/0001104659-09-021798-index.htm,3/31/2009,https://www.sec.gov/Archives/edgar/data/1004434/000110465909021798/0001104659-09-021798.txt,AMG,AMG_2009-03-31_0001104659-09-021798.txt,AMG,Affiliated Managers Group Inc,reports,Financials,Asset Management & Custody Banks,"Beverly, Massachusetts",41821,1004434,1993,"['Disciplinary powers include the power to temporarily or permanently revoke the authorization to carry on regulated business following a breach of FSMA 2000 and/or regulatory rules, the suspension of registered employees and censures and fines for both regulated businesses and their registered employees.', '31, 2010, BNY Mellon and its subsidiaries had approximately 48,000 employees.', '83*  |    | Description regarding amendments entered into on December 22, 2006 by Robert P. Kelly and Mellon Financial Corporation to his Change in Control Severance Agreement, employment letter agreement and equity award agreement.', '90* |    | Description regarding amendments entered into on December 22, 2006 by Steven G. Elliott and Mellon Financial Corporation to his Change in Control Severance Agreement, employment agreement, equity award agreement and related matters.']"
257,257,0001047469-09-002123,/Archives/edgar/data/1004434/000104746909002123/0001047469-09-002123-index.htm,3/2/2009,https://www.sec.gov/Archives/edgar/data/1004434/000104746909002123/0001047469-09-002123.txt,AMG,AMG_2009-03-02_0001047469-09-002123.txt,AMG,Affiliated Managers Group Inc,reports,Financials,Asset Management & Custody Banks,"Beverly, Massachusetts",41821,1004434,1993,"['90* |    | Description regarding amendments entered into on December 22, 2006 by Robert P. Kelly and Mellon Financial Corporation to his Change in Control Severance Agreement, employment letter agreement and equity award agreement.', '99* |    | Description regarding amendments entered into on December 22, 2006 by Steven G. Elliott and Mellon Financial Corporation to his Change in Control Severance Agreement, employment agreement, equity award agreement and related matters.']"
258,258,0001047469-08-002079,/Archives/edgar/data/1004434/000104746908002079/0001047469-08-002079-index.htm,2/29/2008,https://www.sec.gov/Archives/edgar/data/1004434/000104746908002079/0001047469-08-002079.txt,AMG,AMG_2008-02-29_0001047469-08-002079.txt,AMG,Affiliated Managers Group Inc,reports,Financials,Asset Management & Custody Banks,"Beverly, Massachusetts",41821,1004434,1993,"['Disciplinary powers include the power to temporarily or permanently revoke the authorization to carry on regulated business following a breach of FSMA 2000 and/or regulatory rules, the suspension of registered employees and censures and fines for both regulated businesses and their registered employees.', '31, 2009, BNY Mellon and its subsidiaries had approximately 42,200 employees.', '90*  |   | Description regarding amendments entered into on December 22, 2006 by Robert P. Kelly and Mellon Financial Corporation to his Change in Control Severance Agreement, employment letter agreement and equity award agreement.', '99*  |   | Description regarding amendments entered into on December 22, 2006 by Steven G. Elliott and Mellon Financial Corporation to his Change in Control Severance Agreement, employment agreement, equity award agreement and related matters.', '105*  |   | Description regarding amendments entered into on December 22, 2006 by Ronald P. O\x92Hanley and Mellon Financial Corporation to his Change in Control Severance Agreement, employment letter agreement, equity award agreement and related matters.']"
259,259,0001104659-07-015471,/Archives/edgar/data/1004434/000110465907015471/0001104659-07-015471-index.htm,3/1/2007,https://www.sec.gov/Archives/edgar/data/1004434/000110465907015471/0001104659-07-015471.txt,AMG,AMG_2007-03-01_0001104659-07-015471.txt,AMG,Affiliated Managers Group Inc,reports,Financials,Asset Management & Custody Banks,"Beverly, Massachusetts",41821,1004434,1993,"['Disciplinary powers include the power to temporarily or permanently revoke the authorization to carry on regulated business following a breach of FSMA 2000 and/or regulatory rules, the suspension of registered employees and censures and fines for both regulated businesses and their registered employees.', '31, 2008, the Company and its subsidiaries had approximately 42,900 employees.', '103* |   | Description regarding amendments entered into on December 22, 2006 by Robert P. Kelly and Mellon Financial Corporation to his Change in Control Severance Agreement, employment letter agreement and equity award agreement.', '115* |   | Description regarding amendments entered into on December 22, 2006 by Steven G. Elliott and Mellon Financial Corporation to his Change in Control Severance Agreement, employment agreement, equity award agreement and related matters.', '121* |   | Description regarding amendments entered into on December 22, 2006 by Ronald P. O\x92Hanley and Mellon Financial Corporation to his Change in Control Severance Agreement, employment letter agreement, equity award agreement and related matters.']"
260,260,0001047469-06-003533,/Archives/edgar/data/1004434/000104746906003533/0001047469-06-003533-index.htm,3/16/2006,https://www.sec.gov/Archives/edgar/data/1004434/000104746906003533/0001047469-06-003533.txt,AMG,AMG_2006-03-16_0001047469-06-003533.txt,AMG,Affiliated Managers Group Inc,reports,Financials,Asset Management & Custody Banks,"Beverly, Massachusetts",41821,1004434,1993,"['Disciplinary powers include the power to temporarily or permanently revoke the authorization to carry on regulated business following a breach of FSMA 2000 and/or regulatory rules, the suspension of registered employees and censures and fines for both regulated businesses and their registered employees.', '31, 2007, The Bank of New York Mellon and its subsidiaries had approximately 42,100 employees.', '103* |   | Description regarding amendments entered into on December 22, 2006 by Robert P. Kelly and Mellon Financial Corporation to his Change in Control Severance Agreement, employment letter agreement and equity award agreement.', '115* |   | Description regarding amendments entered into on December 22, 2006 by Steven G. Elliott and Mellon Financial Corporation to his Change in Control Severance Agreement, employment agreement, equity award agreement and related matters.', '121* |   | Description regarding amendments entered into on December 22, 2006 by Ronald P. O\x92Hanley and Mellon Financial Corporation to his Change in Control Severance Agreement, employment letter agreement, equity award agreement and related matters.']"
261,261,0001047469-05-006812,/Archives/edgar/data/1004434/000104746905006812/0001047469-05-006812-index.htm,3/16/2005,https://www.sec.gov/Archives/edgar/data/1004434/000104746905006812/0001047469-05-006812.txt,AMG,AMG_2005-03-16_0001047469-05-006812.txt,AMG,Affiliated Managers Group Inc,reports,Financials,Asset Management & Custody Banks,"Beverly, Massachusetts",41821,1004434,1993,"['Employees  For the quarter ended December 31, 2017, BB&T had 36,484 full-time equivalent employees, compared to 37,481 full-time equivalent employees for the quarter ended December 31, 2016.', 'Noninterest income increased $310 million for the year, driven by improvements in FDIC loss share income, higher other income primarily due to income from SBIC investment and income related to assets for certain post-employment benefits, and higher insurance income primarily from the acquisition of Swett and Crawford in 2016.', 'Other income totaled $467 million for 2017, an increase of $105 million from 2016, primarily due to a $34 million increase in income from SBIC investments and a $50 million increase driven by income related to assets for certain post-employment benefits.', 'Noninterest expense decreased $104 million, primarily due to lower personnel expense driven by a change in the allocation approach for capitalized loan origination costs in the current year as well as a decline in salaries expense and employee benefits expense.', 'Noninterest income increased $46 million, which reflects the acquisition of Swett and Crawford in April 2016 and higher property and casualty insurance commissions, as well as higher life insurance commissions and employee benefit commissions.', 'Noninterest expense increased $457 million, primarily due to the first quarter 2017 loss of $392 million on the early extinguishment of higher-cost FHLB advances, as well as higher personnel expense driven by a change in allocation approach for capitalized loan origination costs and higher expense related to assets for certain post- employment benefits.', 'Noninterest income increased $120 million, which primarily reflects the acquisition of Swett and Crawford and higher property and casualty insurance commissions, employee benefit commissions and life insurance commissions, partially offset by the sale of American Coastal in the second quarter of 2015.']"
262,262,0001047469-04-008009,/Archives/edgar/data/1004434/000104746904008009/0001047469-04-008009-index.htm,3/15/2004,https://www.sec.gov/Archives/edgar/data/1004434/000104746904008009/0001047469-04-008009.txt,AMG,AMG_2004-03-15_0001047469-04-008009.txt,AMG,Affiliated Managers Group Inc,reports,Financials,Asset Management & Custody Banks,"Beverly, Massachusetts",41821,1004434,1993,"['Employees  For the quarter ended December 31, 2016, BB&T had approximately 37,500 full- time equivalent employees, compared to approximately 36,000 full-time equivalent employees for the quarter ended December 31, 2015.', 'This decline is primarily due to the $26 million loss on sale of American Coastal during the second quarter of 2015 and $18 million of lower income related to assets for certain post-employment benefits (which is offset in personnel expense).', 'Noninterest income increased $118 million, which primarily reflects the acquisition of Swett and Crawford and higher property and casualty insurance, employee benefit commissions and life insurance, partially offset by the sale of American Coastal in the second quarter of 2015.']"
263,263,0001047469-03-011288,/Archives/edgar/data/1004434/000104746903011288/0001047469-03-011288-index.htm,3/31/2003,https://www.sec.gov/Archives/edgar/data/1004434/000104746903011288/0001047469-03-011288.txt,AMG,AMG_2003-03-31_0001047469-03-011288.txt,AMG,Affiliated Managers Group Inc,reports,Financials,Asset Management & Custody Banks,"Beverly, Massachusetts",41821,1004434,1993,"[""__Pay Ratio Disclosure__    The SEC has adopted amendments to Item 402 of Regulation S-K to require disclosure of: (1) the median compensation amount of the annual total compensation of all employees of a registrant (excluding the CEO), (2) the annual total compensation of that registrant's CEO and (3) the ratio of the median of the annual total compensation of all employees (excluding the CEO) to the annual total compensation of the CEO."", '**_Employees_**    At December 31, 2015, BB&T had approximately 37,200 employees, the majority of which were full time, compared to approximately 33,400 employees at December 31, 2014.', 'This decline is primarily due to the $26 million loss on sale of American Coastal during the second quarter of 2015 and $18 million of lower income related to assets for certain post-employment benefits (which is offset in personnel expense).', 'Other income decreased $96 million in 2014, primarily due to a $31 million gain on the sale of a consumer lending subsidiary in 2013, a $24 million decrease in income from assets related to certain post-employment benefits, which is offset in personnel expense, and an $8 million decrease in letter of credit fees.', '7 billion increased $128 million, primarily due to increased commissions on new and renewal property and casualty business, higher performance-based commissions and an increase in employee benefit commissions.', 'Noninterest income decreased $170 million primarily due to lower securities gains in the investment portfolio, lower FDIC loss share income, the sale of a consumer lending subsidiary during the fourth quarter of 2013 and lower income from assets related to certain post-employment benefits.']"
264,264,0000912057-02-012931,/Archives/edgar/data/1004434/000091205702012931/0000912057-02-012931-index.htm,4/1/2002,https://www.sec.gov/Archives/edgar/data/1004434/000091205702012931/0000912057-02-012931.txt,AMG,AMG_2002-04-01_0000912057-02-012931.txt,AMG,Affiliated Managers Group Inc,reports,Financials,Asset Management & Custody Banks,"Beverly, Massachusetts",41821,1004434,1993,"['**_Employees_**    At December 31, 2014, BB&T had approximately 33,400 employees, the majority of which were full time, compared to approximately 35,000 employees at December 31, 2013.', 'Other income decreased $60 million in 2014 compared to 2013, primarily due to a $31 million gain on the sale of a consumer lending subsidiary in 2013, a $24 million decrease in income from assets related to certain post-employment benefits, which is offset in personnel expense, and an $8 million decrease in letter of credit fees.', 'Other income increased $63 million in 2013 compared to 2012, primarily due to a $31 million gain on the sale of a consumer lending subsidiary in 2013, a $22 million increase in income from operating leases and a $21 million increase in income from assets related to certain post-employment benefits, which is offset in personnel expense.', '2  |   |        _2014 compared to 2013_    Personnel expense is the largest component of noninterest expense and includes salaries, wages and incentives, as well as pension and other employee benefit costs.', '7 billion increased $128 million, primarily due to increased commissions on new and renewal property and casualty business, higher performance-based commissions and an increase in employee benefit commissions.', 'Noninterest income decreased $159 million primarily due to lower securities gains in the investment portfolio, lower FDIC loss share income, the sale of a consumer lending subsidiary during the fourth quarter of 2013 and lower income from assets related to certain post-employment benefits.', 'The $136 million increase in noninterest income primarily reflects the gain on the sale of a consumer lending subsidiary totaling $31 million, higher income from assets related to certain post-employment benefits, higher securities gains in the investment portfolio and higher FDIC loss share income.']"
265,265,0000912057-01-506196,/Archives/edgar/data/1004434/000091205701506196/0000912057-01-506196-index.htm,4/2/2001,https://www.sec.gov/Archives/edgar/data/1004434/000091205701506196/0000912057-01-506196.txt,AMG,AMG_2001-04-02_0000912057-01-506196.txt,AMG,Affiliated Managers Group Inc,reports,Financials,Asset Management & Custody Banks,"Beverly, Massachusetts",41821,1004434,1993,"['**_Employees_**    At December 31, 2013, BB&T had approximately 33,700 full-time equivalent employees compared to approximately 34,000 full-time equivalent employees at December 31, 2012.', 'Other income increased $63 million in 2013 compared to 2012, primarily due to a $31 million gain on the sale of a consumer lending subsidiary in 2013, a $22 million increase in income from operating leases and a $21 million increase in income from assets related to certain post-employment benefits, which is offset in personnel expense.', '4  |   |        47   ---      Table of Contents   ---      _2013 compared to 2012_    Personnel expense is the largest component of noninterest expense and includes salaries, wages and incentives, as well as pension and other employee benefit costs.', 'The $128 million increase in noninterest income primarily reflects the gain on the sale of a consumer lending subsidiary totaling $31 million, higher income from assets related to certain post-employment benefits, higher securities gains in the investment portfolio, and higher FDIC loss share income.', 'Employee benefits commission growth was primarily due to the fourth quarter 2011 acquisitions of Precept, a full-service employee benefits consulting and administrative solutions firm with offices in Irvine and San Ramon, California and Liberty Benefit Insurance Services, a full-service employee benefits broker located in San Jose, California.']"
266,266,0000912057-00-015163,/Archives/edgar/data/1004434/0000912057-00-015163-index.html,3/30/2000,https://www.sec.gov/Archives/edgar/data/1004434/000091205700015163/0000912057-00-015163.txt,AMG,AMG_2000-03-30_0000912057-00-015163.txt,AMG,Affiliated Managers Group Inc,reports,Financials,Asset Management & Custody Banks,"Beverly, Massachusetts",41821,1004434,1993,"['**_Employees_**  At December 31, 2012, BB&T had approximately 34,000 full-time equivalent employees compared to approximately 31,800 full-time equivalent employees at December 31, 2011.', '3  |   |      _2012 compared to 2011_  Personnel expense is the largest component of noninterest expense and includes salaries, wages and incentives, as well as pension and other employee benefit costs.', 'Employee benefits commission growth was primarily due to the acquisitions of Precept, a full-service employee benefits consulting and administrative solutions firm with offices in Irvine and San Ramon, California and Liberty Benefit Insurance Services, a full-service employee benefits broker located in San Jose, California, in the fourth quarter of 2011.', ""BB&T's 2012 and 2004 Plans are intended to assist the Company in recruiting and retaining employees, directors and independent contractors and to associate the interests of eligible participants with those of BB&T and its shareholders."", 'In 2004, BB&T amended this plan to eliminate the subsidy for those employees retiring after December 31, 2004.']"
267,267,0001047469-99-012958,/Archives/edgar/data/1004434/0001047469-99-012958-index.html,3/31/1999,https://www.sec.gov/Archives/edgar/data/1004434/000104746999012958/0001047469-99-012958.txt,AMG,AMG_1999-03-31_0001047469-99-012958.txt,AMG,Affiliated Managers Group Inc,reports,Financials,Asset Management & Custody Banks,"Beverly, Massachusetts",41821,1004434,1993,"['**_Employees_**  At December 31, 2011, BB&T had approximately 31,800 full-time equivalent employees compared to approximately 31,400 full-time equivalent employees at December 31, 2010.', 'In addition, significant declines in the housing market from 2007 through 2010, with falling home prices and increasing foreclosures and unemployment, resulted in significant write-downs of asset values by many financial institutions, including government-sponsored entities and major commercial and investment banks.', '7 %  |      Pension and other employee benefits  |   |   | 484  |   |   |   | 463  |   |   |   | 517  |   |   |   | 4.', 'Acquisitions completed in 2011 included Precept, a full- service employee benefits consulting and administrative solutions firm with offices in Irvine and San Ramon, California; Liberty Benefit Insurance Services, a full-service employee benefits broker located in San Jose, California; and Atlantic Risk Management Corporation, a commercial property and casualty and employee benefits broker located in Columbia, Maryland.', 'BB&T\x92s 2004 Plan is intended to assist the Corporation in recruiting and retaining employees, directors and independent contractors and to associate the interests of eligible participants with those of BB&T and its shareholders.', 'In 2004, BB&T amended this plan to eliminate the subsidy for those employees retiring after December 31, 2004.']"
268,268,0001047469-98-012966,/Archives/edgar/data/1004434/0001047469-98-012966-index.html,3/31/1998,https://www.sec.gov/Archives/edgar/data/1004434/000104746998012966/0001047469-98-012966.txt,AMG,AMG_1998-03-31_0001047469-98-012966.txt,AMG,Affiliated Managers Group Inc,reports,Financials,Asset Management & Custody Banks,"Beverly, Massachusetts",41821,1004434,1993,"['**Employees**    At December 31, 2010, BB&T had approximately 31,400 full-time equivalent employees compared to approximately 32,400 full-time equivalent employees at December 31, 2009.', 'The increase of $57 million in 2009 compared to 2008 was primarily due to a $74 million increase in the value of various financial assets isolated for the purpose of providing post-employment benefits.', '4 | %      Pension and other employee benefits  |    | ** ** | **463** | **   ** |    |   | 517 |    |    |   | 338 |    | |   | (10.', 'BB&T\x92s 2004 Plan is intended to assist the Corporation in recruiting and retaining employees, directors and independent contractors and to associate the interests of eligible participants with those of BB&T and its    134  * * *  ##### Table of Contents  shareholders.']"
269,269,0000004977-18-000054,/Archives/edgar/data/4977/000000497718000054/0000004977-18-000054-index.htm,2/23/2018,https://www.sec.gov/Archives/edgar/data/4977/000000497718000054/0000004977-18-000054.txt,AFL,AFL_2018-02-23_0000004977-18-000054.txt,AFL,AFLAC Inc,reports,Financials,Life & Health Insurance,"Columbus, Georgia",36308,4977,1955,"['**Employees**    At December 31, 2009, BB&T had approximately 32,400 full-time equivalent employees compared to approximately 29,600 full-time equivalent employees at December 31, 2008.', '9%, in 2009 compared to 2008, primarily due to a $74 million increase in the value of various financial assets isolated for the purpose of providing post-employment benefits.', '6 | %      Pension and other employee benefits  |    | ** ** | **517** |     |   | 338 |    |   | 379 |    | 53.', 'The increase in noninterest expense was largely due to increases of $115 million for foreclosed property, $34 million in FDIC insurance expense, $17 million from increased pension costs, $38 million for post-employment benefits expense that are offset by additional noninterest income and approximately $159 million of growth resulting from purchase acquisitions.', 'BB&T\x92s 2004 Plan is intended to assist the Corporation in recruiting and retaining employees, directors and independent contractors and to associate the interests of eligible participants with those of BB&T and its shareholders.']"
270,270,0000004977-17-000064,/Archives/edgar/data/4977/000000497717000064/0000004977-17-000064-index.htm,2/24/2017,https://www.sec.gov/Archives/edgar/data/4977/000000497717000064/0000004977-17-000064.txt,AFL,AFL_2017-02-24_0000004977-17-000064.txt,AFL,AFLAC Inc,reports,Financials,Life & Health Insurance,"Columbus, Georgia",36308,4977,1955,"['Prior to November 14, 2011, unless BB&T has redeemed all of the preferred stock, or the Treasury Department has transferred all of the preferred stock to a third party, the consent of the Treasury Department will be required for BB&T to, among other things, increase common stock dividends or effect repurchases of common stock or other preferred stock (with certain exceptions, including the repurchase of BB&T common stock to offset share dilution from equity-based employee compensation awards).', '**Employees**    At December 31, 2008, BB&T had approximately 29,600 full-time equivalent employees compared to approximately 29,400 full-time equivalent employees at December 31, 2007.', 'The increase in commission income during 2007 was primarily related to the sale of property and casualty, and employee benefit insurance, which increased $17 million and $9 million, respectively, compared to 2006.', 'Other income for 2007 also reflects lower revenues from venture capital investments, which decreased    59  * * *  ##### Table of Contents  $15 million compared to 2006, and decreased revenues of $11 million related to various financial assets isolated for the purpose of providing post-employment benefits.', '9 | %      Pension and other employee benefits  |    |   | 338 |    |   | 379 |    |   | 377 |    | (10.', '123\x94), for all awards granted to employees prior to the effective date of SFAS No.', 'BB&T\x92s 2004 Plan is intended to assist the Corporation in recruiting and retaining employees, directors and independent contractors and to associate the interests of eligible participants with those of BB&T and its shareholders.', 'Also, to promote revenue growth and provide a basis    136  * * *  ##### Table of Contents  **BB &T CORPORATION AND SUBSIDIARIES **    **NOTES TO CONSOLIDATED FINANCIAL STATEMENTS \x97(Continued) **    for employee incentives, certain revenues of Residential Mortgage Banking, Sales Finance, Specialized Lending, Insurance Services, Financial Services and other segments are reflected in the individual segment results and also allocated to the Banking Network.']"
271,271,0000004977-16-000259,/Archives/edgar/data/4977/000000497716000259/0000004977-16-000259-index.htm,2/25/2016,https://www.sec.gov/Archives/edgar/data/4977/000000497716000259/0000004977-16-000259.txt,AFL,AFL_2016-02-25_0000004977-16-000259.txt,AFL,AFLAC Inc,reports,Financials,Life & Health Insurance,"Columbus, Georgia",36308,4977,1955,"['**Employees**    At December 31, 2007, BB&T had approximately 29,400 full-time equivalent employees compared to approximately 29,300 full-time equivalent employees at December 31, 2006.', 'The increase in insurance commissions in 2007 compared to 2006 was primarily related to the sale of property and casualty, and employee benefit insurance, which increased $17.', 'The increase in commission income during 2006 included increases in property and casualty insurance and employee benefit-related insurance commissions of $77 million and $10 million, respectively, compared to 2005.', 'Other income for 2007 also reflects lower revenues from investments managed by BB&T Capital Partners, a small business investment company, which decreased $15 million compared to 2006, and decreased revenues of $11 million related to various financial assets isolated for the purpose of providing post-employment benefits.', 'In addition, 2006 includes increases of $8 million in revenues from various financial assets isolated for the purpose of providing post-employment benefits and $8 million related to trading income at Scott & Stringfellow.', '3 | %      Pension and other employee benefits  |    |   | 379 |    |   | 377 |    |   | 311 |   |   | .', 'In addition, expense related to post- employment benefits, excluding defined contribution plan expenses, increased $18 million and health care and other welfare expenses increased $14 million compared to 2005.', '123\x94), for all awards granted to employees prior to the effective date of SFAS No.', '123, BB&T accounted for share-based awards granted to employees prior to January 1, 2006 using the intrinsic value method prescribed by Accounting Principles Board Opinion No.', 'BB&T\x92s 2004 Plan is intended to assist the Corporation in recruiting and retaining employees, directors and independent contractors and to associate the interests of eligible participants with those of BB&T and its shareholders.']"
272,272,0000004977-15-000071,/Archives/edgar/data/4977/000000497715000071/0000004977-15-000071-index.htm,2/26/2015,https://www.sec.gov/Archives/edgar/data/4977/000000497715000071/0000004977-15-000071.txt,AFL,AFL_2015-02-26_0000004977-15-000071.txt,AFL,AFLAC Inc,reports,Financials,Life & Health Insurance,"Columbus, Georgia",36308,4977,1955,"['**Employees**    At December 31, 2006, BB&T had approximately 29,300 full-time equivalent employees compared to approximately 27,700 full-time equivalent employees at December 31, 2005.', 'During 2006, BB&T estimated that 147 positions would be eliminated and receive severance due to mergers and 114 employees did, in fact, receive severance in 2006.', 'Sixty-one former employees will continue to receive merger-related severance payments during 2007.', 'During 2004, BB&T estimated that 200 positions would be eliminated and receive severance in connection with the acquisition of Republic and 225 employees did, in fact, receive severance in 2004.', 'Nine former employees continued to receive severance payments during 2005.', 'These increases were primarily related to property and casualty insurance and employee benefit-related insurance products, which increased $77 million and $10 million, respectively, compared to 2005.', 'The increase in commission income during 2005 was also generated primarily from CRC, BB&T Insurance and McGriff and included increases in property and casualty insurance, employee benefit-related insurance and other insurance fees and commissions of $67 million, $16 million and $15 million, respectively compared to 2004.', 'In addition, 2006 includes increases of $8 million in revenues from various financial assets isolated for the purpose of providing post-employee benefits and $8 million related to trading income at Scott & Stringfellow.', 'These increases were offset by decreases related to derivative valuations and ineffectiveness of hedging derivatives, and lower income from various financial assets isolated for the purpose of providing post-employee benefits of $4 million and $3 million, respectively, during 2005 as compared to 2004.', '2 | %      Pension and other employee benefits  |    |   | 377 |    |   | 311 |   |   |   | 294 |    | 21.', 'In addition, expense related to post- employment benefits, excluding defined contribution plan expenses, increased $18 million and health care and other welfare expenses increased $14 million compared to 2005.', '123\x94), for all awards granted to employees prior to the effective date of SFAS No.', '123, BB&T accounted for share-based awards granted to employees prior to January 1, 2006 using the intrinsic value method prescribed by Accounting Principles Board Opinion No.', 'The costs related to existing BB&T facilities and personnel are recorded in accordance with the guidance in SFAS 146, _\x93 Accounting for Costs Associated with Exit or Disposal Activities\x94_ and SFAS 112, _\x93 Employers\x92 Accounting for Postemployment Benefits\x94_, as appropriate, and reflected as merger-related and restructuring charges in the Consolidated Statements of Income.', 'During 2006, BB&T estimated that 147 positions would be eliminated and receive severance due to mergers and 114 employees did, in fact, receive severance in 2006.', 'Sixty-one former employees will continue to receive merger-related severance payments during 2007.', 'During 2004, BB&T estimated that 200 positions would be eliminated and receive severance in connection with the acquisition of Republic and 225 employees did, in fact, receive severance in 2004.', 'Nine former employees continued to receive severance payments during 2005\\.', 'BB&T\x92s 2004 Plan is intended to assist the Corporation in recruiting and retaining employees, directors and independent contractors and to associate the interests of eligible participants with those of BB&T and its shareholders.', 'Effective, January 1, 2007, BB&T increased the maximum contribution rate from 25% to 50% of an employee\x92s cash compensation.']"
273,273,0000004977-14-000052,/Archives/edgar/data/4977/000000497714000052/0000004977-14-000052-index.htm,2/27/2014,https://www.sec.gov/Archives/edgar/data/4977/000000497714000052/0000004977-14-000052.txt,AFL,AFL_2014-02-27_0000004977-14-000052.txt,AFL,AFLAC Inc,reports,Financials,Life & Health Insurance,"Columbus, Georgia",36308,4977,1955,"['**Employees**    At December 31, 2005, BB&T had approximately 27,700 full-time equivalent employees compared to approximately 26,100 full-time equivalent employees at December 31, 2004.', 'During 2004, BB&T estimated that 200 positions would be eliminated and receive severance in connection with the acquisition of Republic and 225 employees did, in fact, receive severance in 2004.', 'Nine former employees    39  * * *  continued to receive severance payments during 2005.', 'During 2003, BB&T estimated that 1,918 positions would be eliminated and receive severance and 980 employees did, in fact, receive severance during 2003.', 'A total of 551 of the employees whose jobs were eliminated received severance payments during 2004.', '4 billion in trust assets from the North Carolina state employees\x92 401 (k) plan, which transferred to a successor trustee at the end of the quarter.', '0 | %      Pension and other employee benefits  |    |   | 311,069 |   |   |   | 293,449 |    |   | 271,419 |    | 6.', '1% increase in pension and other employee benefit costs was also affected by the above mergers, which caused increases in all categories of benefit expenses compared to 2003.', '123\x94), BB&T currently accounts for share-based payments to employees using the intrinsic value method prescribed by Accounting Principles Board Opinion No.', '123(R) requires all share-based payments to employees, including grants of employee stock options, to be expensed based on their fair values.', '123 for all awards granted to employees prior to the effective date of SFAS No.', 'The costs related to existing BB&T facilities and personnel are recorded in accordance with the guidance in SFAS 146, _\x93 Accounting for Costs Associated with Exit or Disposal Activities\x94_ and SFAS 112, _\x93 Employers\x92 Accounting for Postemployment Benefits\x94_, as appropriate, and reflected as merger-related and restructuring charges on the Consolidated Statements of Income.', 'During 2003, BB&T estimated that 1,918 positions would be eliminated and receive severance and 980 employees did, in fact, receive severance during 2003.', 'A total of 551 of the employees whose jobs were eliminated received severance payments during 2004.', 'BB&T\x92s 2004 Stock Incentive Plan is intended to assist the Corporation in recruiting and retaining employees, directors and independent contractors and to associate the interests of eligible participants with those of BB&T and its shareholders.']"
274,274,0000004977-13-000030,/Archives/edgar/data/4977/000000497713000030/0000004977-13-000030-index.htm,2/27/2013,https://www.sec.gov/Archives/edgar/data/4977/000000497713000030/0000004977-13-000030.txt,AFL,AFL_2013-02-27_0000004977-13-000030.txt,AFL,AFLAC Inc,reports,Financials,Life & Health Insurance,"Columbus, Georgia",36308,4977,1955,"['**Employees**    At December 31, 2004, BB&T had approximately 26,100 full-time equivalent employees compared to approximately 26,300 full-time equivalent employees at December 31, 2003.', 'During 2004, BB&T estimated that 200 positions would be eliminated and receive severance in connection with the acquisition of Republic and 225 employees did, in fact, receive severance in 2004.', 'Nine former employees will continue to receive severance payments during 2005.', 'During 2003, BB&T estimated that 1,918 positions would be eliminated and receive severance and 980 employees did, in fact, receive severance during 2003.', 'Approximately 551 of the employees whose jobs were eliminated received severance payments during 2004.', 'During 2002, BB&T estimated that 372 positions would be eliminated and receive severance and 370 employees did, in fact, receive severance during 2002.', 'Approximately 90 of these former employees continued to receive severance payments during 2003.', 'In 2004, BB&T employed a risk management strategy for mortgage servicing rights that was entirely dependent upon derivative financial instruments.', '4 billion in trust assets from the North Carolina state employees\x92    41  * * *  ##### Table of Contents  401 (k) plan, which transferred to a successor trustee at the end of the quarter.', '1 | %      Pension and other employee benefits  |    |   | 293,449 |    |   | 271,419 |    |   | 226,914 |    | 8.', '1% increase in pension and other employee benefit costs was also affected by the above mergers, which caused increases in all categories of benefit expenses compared to 2003.', 'The 2003 increase was caused by higher advertising and public relations expenses, charitable contributions, employee travel, supplies expense, and net losses from the disposition of fixed assets.', 'The decrease in allocated expenses in 2003 resulted from a refinement in the allocation methodologies during 2003 to allocated expenses based on loan and deposit volumes and total segment assets or full- time equivalent employees assigned to the segment, as applicable.', '123(R) requires all share-based payments to employees, including grants of employee stock options, to be recognized in the income statement based on their fair values.', '123 for all awards granted to employees prior to the effective date of SFAS No.', '123, BB&T currently accounts for share-based payments to employees using Opinion 25\x92s intrinsic value method and, as such, generally recognizes no compensation cost for employee stock options.', 'During 2004, BB&T estimated that 200 positions would be eliminated and receive severance in connection with the acquisition of Republic and 225 employees did, in fact, receive severance in 2004.', 'Nine former employees will continue to receive severance payments during 2005.', 'During 2003, BB&T estimated that 1,918 positions would be eliminated and receive severance and 980 employees did, in fact, receive severance during 2003.', 'Approximately 551 of the employees whose jobs were eliminated received severance payments during 2004.', 'During 2002, BB&T estimated that 372 positions would be eliminated and receive severance and 370 employees did, in fact, receive severance during 2002.', 'Approximately 90 of these former employees continued to receive severance payments during 2003.', 'BB&T\x92s 2004 Stock Incentive Plan is intended to assist the Corporation in recruiting and retaining employees, directors and independent contractors and to associate the interests of eligible participants with those of BB&T and its shareholders.', 'Each non-employee director may elect to defer 0%, 50% or 100% of certain fees for each calendar year and apply that percentage toward the grant of options to purchase BB&T common stock.', 'BB&T also offers defined contribution plans to certain employees of subsidiaries who do not participate in the 401 (k) Savings Plan.', 'BB&T allocates expenses to the reportable segments based on various methodologies, including volume and amount of loans and deposits, amount of total assets and liabilities and the volume of full-time equivalent    115  * * *  ##### Table of Contents  **BB &T CORPORATION AND SUBSIDIARIES **    **NOTES TO CONSOLIDATED FINANCIAL STATEMENTS \x97(Continued) **    employees serviced.']"
275,275,0001193125-12-081967,/Archives/edgar/data/4977/000119312512081967/0001193125-12-081967-index.htm,2/27/2012,https://www.sec.gov/Archives/edgar/data/4977/000119312512081967/0001193125-12-081967.txt,AFL,AFL_2012-02-27_0001193125-12-081967.txt,AFL,AFLAC Inc,reports,Financials,Life & Health Insurance,"Columbus, Georgia",36308,4977,1955,[]
276,276,0001193125-11-047639,/Archives/edgar/data/4977/000119312511047639/0001193125-11-047639-index.htm,2/25/2011,https://www.sec.gov/Archives/edgar/data/4977/000119312511047639/0001193125-11-047639.txt,AFL,AFL_2011-02-25_0001193125-11-047639.txt,AFL,AFLAC Inc,reports,Financials,Life & Health Insurance,"Columbus, Georgia",36308,4977,1955,"['15  * * *  ##### Table of Contents  **Employees**    At December 31, 2003, BB&T had approximately 26,300 full-time equivalent employees compared to approximately 23,000 full-time equivalent employees at December 31, 2002.', 'During 2003, BB&T estimated that 1,918 positions would be eliminated and 980 employees had, in fact, been terminated prior to December 31, 2003.', 'Approximately 551 of these employees will continue to receive severance payments during 2004.', 'During 2002, BB&T estimated that 372 positions would be eliminated and 370 employees were, in fact, terminated prior to December 31, 2002.', 'Approximately 90 of these employees continued to receive severance payments during 2003.', 'During 2001, BB&T estimated that 400 positions would be eliminated and approximately 350 employees were terminated and received severance by the end of 2001.', '4 billion in trust assets from the North Carolina state employees\x92 401-K plan, which transferred to a successor trustee.', '0 | %      Pension and other employee benefits  |    |   | 280,688 |    |   | 234,586 |    |   | 194,223 |    | 19.', 'In addition to the effect of purchasing First Virginia, the majority of the 2003 increase resulted from higher advertising and public relations expenses, charitable contributions, employee travel, supplies expenses, and net losses from the disposition of fixed assets.', '3%, in 2003 compared with 2002 because of increased employee related expenses and additional expenses resulting from acquired institutions, while corporate expenses allocated to the Banking Network decreased $82.', '3%, over the same time frame, because of a refinement in BB&T\x92s expense allocation methodologies during 2003 to allocate expenses based on loan and deposit volumes and total segment assets or full-time equivalent employees assigned to the segment, as applicable.', '123 to provide alternative methods of transition for an entity that voluntarily changes to the fair value based method of accounting for stock-based employee compensation.', 'During 2003, BB&T estimated that 1,918 positions would be eliminated and 980 employees had, in fact, been terminated prior to December 31, 2003.', 'Approximately 551 of these employees will continue to receive severance payments during 2004.', 'During 2002, BB&T estimated that 372 positions would be eliminated and 370 employees were terminated prior to December 31, 2002.', 'Approximately 90 of these employees continued to receive severance payments during 2003.', 'During 2001, BB&T estimated that 400 positions would be eliminated and approximately 350 employees were terminated and received severance by the end of 2001\\.', 'Each non-employee director may elect to defer 0%, 50% or 100% of certain fees for each calendar year and apply that percentage toward the grant of options to purchase BB&T common stock.']"
277,277,0001193125-10-043173,/Archives/edgar/data/4977/000119312510043173/0001193125-10-043173-index.htm,2/26/2010,https://www.sec.gov/Archives/edgar/data/4977/000119312510043173/0001193125-10-043173.txt,AFL,AFL_2010-02-26_0001193125-10-043173.txt,AFL,AFLAC Inc,reports,Financials,Life & Health Insurance,"Columbus, Georgia",36308,4977,1955,"['**Employees**    At December 31, 2002, BB&T had approximately 22,500 full-time equivalent employees compared to approximately 20,400 full-time equivalent employees at December 31, 2001.', 'During 2002, BB&T estimated that 372 positions would be eliminated and 370 employees were, in fact, terminated prior to December 31, 2002.', 'Approximately 90 of these employees will continue to receive severance payments during 2003.', 'During 2001, BB&T estimated that approximately 400 positions would be eliminated and approximately 350 employees were terminated and received severance by the end of 2001.', 'During 2000, BB&T estimated that 450 positions would be eliminated in connection with mergers and approximately 430 employees were terminated and received severance.', 'The majority of the 2002 increase resulted from higher software expenses, deposit related expenses, employee travel, courier and postage expenses.', '0  |  %      Pension and other employee benefits  |    |    |  234,586  |    |    |  194,223  |    |    |  175,512  |    |  20.', '123 to provide alternative methods of transition for an entity that voluntarily changes to the fair value based method of accounting for stock-based employee compensation.', 'During 2002, BB&T estimated that 372 positions would be eliminated and 370 employees were terminated prior to December 31, 2002.', 'Approximately 90 of these employees will continue to receive severance payments during 2003.', 'During 2001, BB&T estimated that approximately 400 positions would be eliminated and approximately 350 employees were terminated and received severance by the end of 2001.', 'During 2000, BB&T estimated that 450 positions would be eliminated in connection with mergers and approximately 430 employees were terminated and received severance.', 'Each non-employee director may elect to defer 0%, 50% or 100% of the annual retainer fee for each calendar year and apply that percentage toward the grant of options to purchase BB&T common stock.']"
278,278,0000950144-09-001463,/Archives/edgar/data/4977/000095014409001463/0000950144-09-001463-index.htm,2/20/2009,https://www.sec.gov/Archives/edgar/data/4977/000095014409001463/0000950144-09-001463.txt,AFL,AFL_2009-02-20_0000950144-09-001463.txt,AFL,AFLAC Inc,reports,Financials,Life & Health Insurance,"Columbus, Georgia",36308,4977,1955,"['**Employees**    At December 31, 2001, BB&T had approximately 20,400 full-time equivalent employees compared to approximately 17,500 full-time equivalent employees at December 31, 2000.', 'During 2001, BB&T estimated that 885 positions would be eliminated, and approximately 350 employees were terminated and received severance by the end of 2001, with most of the remaining expected to be terminated following planned systems conversions in 2002.', 'During 2000, BB&T estimated that 450 positions would be eliminated in connection with mergers and approximately 430 employees were terminated and received severance.', 'In 1999, BB&T estimated that 300 positions would be eliminated and 162 employees were terminated and received severance.', '0  |  %      Pension and other employee benefits  |    |    |  192,540  |    |    |  175,512  |    |    |  158,578  |    |  9.', '2%, during 2001 because of increased employee-related expenses, while noninterest expenses allocated from the other operating segments increased $178.', '6%, in 2001 due to higher employee-related costs while noninterest expenses allocated from the other operating segments decreased $.', 'During 2001, BB&T estimated that 885 positions would be eliminated, and approximately 350 employees were terminated and received severance by the end of 2001, with most of the remaining expected to be terminated following planned systems conversions in 2002.', 'During 2000, BB&T estimated that 450 positions would be eliminated in connection with mergers and approximately 430 employees were terminated and received severance.', 'In 1999, BB&T estimated that 300 positions would be eliminated and 162 employees were terminated and received severance.', 'Each non-employee director may elect to defer 0%, 50% or 100% of the annual retainer fee for each calendar year and apply that percentage toward the grant of options to purchase BB&T common stock.']"
279,279,0000950144-08-001495,/Archives/edgar/data/4977/000095014408001495/0000950144-08-001495-index.htm,2/29/2008,https://www.sec.gov/Archives/edgar/data/4977/000095014408001495/0000950144-08-001495.txt,AFL,AFL_2008-02-29_0000950144-08-001495.txt,AFL,AFLAC Inc,reports,Financials,Life & Health Insurance,"Columbus, Georgia",36308,4977,1955,"['**Employees**    At December 31, 2001, BB&T had approximately 20,400 full-time equivalent employees compared to approximately 17,500 full-time equivalent employees at December 31, 2000.', '1  |  %      Pension and other employee benefits  |    |    |  197,672  |    |    |  177,378  |    |    |  158,978  |    |  11.', '2%, during 2001 because of increased employee-related expenses, while noninterest expenses allocated from the other operating segments increased $178.', '6%, in 2001 due to higher employee-related costs while noninterest expenses allocated from the other operating segments decreased $.', 'Each non-employee director may elect to defer 0%, 50% or 100% of the annual retainer fee for each calendar year and apply that percentage toward the grant of options to purchase BB&T common stock.']"
280,280,0001104659-07-015014,/Archives/edgar/data/4977/000110465907015014/0001104659-07-015014-index.htm,2/28/2007,https://www.sec.gov/Archives/edgar/data/4977/000110465907015014/0001104659-07-015014.txt,AFL,AFL_2007-02-28_0001104659-07-015014.txt,AFL,AFLAC Inc,reports,Financials,Life & Health Insurance,"Columbus, Georgia",36308,4977,1955,"['Employees At December 31, 2000, BB&T; had approximately 17,500 full-time equivalent employees compared to approximately 13,700 full-time equivalent employees at December 31, 1999, on an originally-reported basis.', '1% Pension and other employee benefits 164,153 151,264 121,563 8.', 'Each non-employee director may elect to defer 0%, 50% or 100% of the annual retainer fee for each calendar year and apply that percentage toward the grant of options to purchase BB&T; common stock.']"
281,281,0000004977-06-000036,/Archives/edgar/data/4977/000000497706000036/0000004977-06-000036-index.htm,2/28/2006,https://www.sec.gov/Archives/edgar/data/4977/000000497706000036/0000004977-06-000036.txt,AFL,AFL_2006-02-28_0000004977-06-000036.txt,AFL,AFLAC Inc,reports,Financials,Life & Health Insurance,"Columbus, Georgia",36308,4977,1955,"['49  Employees At December 31, 1999, BB &T; had approximately 13,700 full-time-equivalent employees compared to approximately 10,400 full-time equivalent employees at December 31, 1998.', '9% Pension and other employee benefits 121,123 100,953 110,506 20.', 'Each non-employee director may elect to defer 0%, 50% or 100% of the annual retainer fee for each calendar year and apply that percentage toward the grant of options to purchase BB&T; common stock.', 'The new plan covers employees retiring after December 31, 1995 who are eligible for participation in the BB&T; pension plan and have at least ten years of service.', ""BB&T; matches up to 6% of the employee's compensation with a 100% matching contribution.""]"
282,282,0000004977-05-000049,/Archives/edgar/data/4977/000000497705000049/0000004977-05-000049-index.htm,3/10/2005,https://www.sec.gov/Archives/edgar/data/4977/000000497705000049/0000004977-05-000049.txt,AFL,AFL_2005-03-10_0000004977-05-000049.txt,AFL,AFLAC Inc,reports,Financials,Life & Health Insurance,"Columbus, Georgia",36308,4977,1955,"['88  13  Employees At December 31, 1998, BB &T; had approximately 10,400 full-time-equivalent employees.', 'Management also employs long-term debt for additional funding, and management significantly increased reliance on longer- term funding sources during 1998.', '1% in 1998 principally as a result of earnings retained after dividends, share issuances made in connection with merger and acquisition activity and shares issued under employee benefit and stock option plans.', '1,091,875 1,498,493 Loan to employee stock ownership plan and unvested restricted stock..................................', '290,210,766 $ -- $1,451,054 $154,034 $1,091,875 $61,585 $2,758,548 =========== ====== ========== ======== ========== ======= ==========  \\- ----- * Other includes unvested restricted stock and a loan to the employee stock ownership plan.', 'Each non-employee director may elect to defer 0%, 50% or 100% of the annual retainer fee for each calendar year and apply that percentage toward the grant of options to purchase BB&T; common stock.', 'The new plan covers employees retiring after December 31, 1995 who are eligible for participation in the BB&T; pension plan and have at least ten years of service.', '97)  401-k Savings Plan Prior to 1996, BB &T; had an Employee Stock Ownership Plan that allowed all employees to acquire BB&T; common stock by contributing up to 15% of their salaries to the plan.', ""BB&T; matched 100% of each employee's contributions, up to a maximum of 6% of the employee's salary."", ""BB&T; matches up to 6% of the employee's compensation with a 100% matching contribution.""]"
283,283,0000004977-04-000030,/Archives/edgar/data/4977/000000497704000030/0000004977-04-000030-index.htm,3/11/2004,https://www.sec.gov/Archives/edgar/data/4977/000000497704000030/0000004977-04-000030.txt,AFL,AFL_2004-03-11_0000004977-04-000030.txt,AFL,AFLAC Inc,reports,Financials,Life & Health Insurance,"Columbus, Georgia",36308,4977,1955,"['EMPLOYEES At December 31, 1997, BB &T; had approximately 9,800 full-time-equivalent employees.', 'Management also employs long-term debt for funding, and management significantly increased reliance on longer-term funding sources during 1997.', '1,428,017 1,231,592 Loan to employee stock ownership plan and unvested restricted stock..................................', '136,051,623 $ -- $680,258 $ 85,185 $1,472,194 $2,237,637 =========== ====== ======== ========= ========== ==========  \\- -------- * Other includes net unrealized appreciation (depreciation) on securities available for sale, unvested restricted stock and a loan to the employee stock ownership plan.', 'Each non-employee director may elect to defer 0%, 50% or 100% of the annual retainer fee for each calendar year and apply that percentage toward the grant of options to purchase BB&T; common stock.', 'Net periodic pension cost, which is included in employee benefits expense, consisted of the following components in 1997, 1996 and 1995.', 'The plan covers employees retiring after December 31, 1995 who are eligible for participation in the BB&T; pension plan and have at least ten years of service.', '0  401-k Savings Plan Prior to 1996, BB &T; had an Employee Stock Ownership Plan which allowed all employees to acquire common stock in BB&T; by contributing up to 15% of their salaries to the plan.', ""BB&T; matched 100% of each employee's contributions, up to a maximum of 6% of the employee's salary."", ""BB&T; matches up to 6% of the employee's compensation with a 100% matching contribution.""]"
284,284,0000004977-03-000098,/Archives/edgar/data/4977/000000497703000098/0000004977-03-000098-index.htm,3/27/2003,https://www.sec.gov/Archives/edgar/data/4977/000000497703000098/0000004977-03-000098.txt,AFL,AFL_2003-03-27_0000004977-03-000098.txt,AFL,AFLAC Inc,reports,Financials,Life & Health Insurance,"Columbus, Georgia",36308,4977,1955,"['EMPLOYEES At December 31, 1996, Southern National had approximately 7,800 full-time- equivalent employees.', 'Management also employs long-term debt for additional funding, and management significantly increased reliance on longer-term funding sources during 1996.', '1,038,067 865,658 Loan to employee stock ownership plan and unvested restricted stock..................................', '109,297,489 $ -- $546,487 $ 134,758 $1,047,924 $1,729,169 =========== ======= ======== ========= ========== ==========  \\- -------- * Other includes net unrealized appreciation (depreciation) on securities available for sale, unvested restricted stock and a loan to the employee stock ownership plan.', 'Each non- employee director may elect to defer 0%, 50% or 100% of the annual retainer fee for each calendar year and apply that percentage toward the grant of options to purchase Southern National common stock.', 'Net periodic pension cost, which is included in employee benefits expense, consisted of the following components in 1996, 1995 and 1994.', 'The new plan covers employees retiring after December 31, 1995 who are eligible for participation in the Southern National pension plan and have at least ten years of service.', '0  68  401-k Savings Plan Prior to 1996, Southern National had an Employee Stock Ownership Plan which allowed all employees to acquire common stock in Southern National by contributing up to 15% of their salaries to the plan.', ""Southern National matched 100% of each employee's contributions, up to a maximum of 6% of the employee's salary."", ""Southern National matches up to 6% of the employee's compensation with a 100% matching contribution.""]"
285,285,0000004977-02-000065,/Archives/edgar/data/4977/000000497702000065/0000004977-02-000065-index.htm,3/27/2002,https://www.sec.gov/Archives/edgar/data/4977/000000497702000065/0000004977-02-000065.txt,AFL,AFL_2002-03-27_0000004977-02-000065.txt,AFL,AFLAC Inc,reports,Financials,Life & Health Insurance,"Columbus, Georgia",36308,4977,1955,"['EMPLOYEES At December 31, 1995, Southern National had approximately 7,700 full-time- equivalent employees.', '847,550 775,979 Loan to employee stock ownership plan and unvested restricted stock..................................', ""106 allowed employers to recognize the transition obligation associated with implementation immediately, subject to certain limitations, or on a delayed basis over the plan participants' II-54  future service periods."", 'Each non-employee director may elect to defer 0%, 50% or 100% of the annual retainer fee for each calendar year and apply that percentage toward the grant of options to purchase Southern National common stock.', 'Net periodic pension cost, which is included in employee benefits expense, consisted of the following components in 1995, 1994 and 1993.', 'The Plan covers employees retiring after January 1, 1993 who are eligible for participation in the Southern National pension plan and have at least ten years of service.', ""Southern National matches 100% of each employee's contributions, up to a maximum of 6% of the employee's salary."", ""Southern National matches up to 6% of the employee's compensation with a 100% matching contribution.""]"
286,286,0000004977-01-500045,/Archives/edgar/data/4977/000000497701500045/0000004977-01-500045-index.htm,3/28/2001,https://www.sec.gov/Archives/edgar/data/4977/000000497701500045/0000004977-01-500045.txt,AFL,AFL_2001-03-28_0000004977-01-500045.txt,AFL,AFLAC Inc,reports,Financials,Life & Health Insurance,"Columbus, Georgia",36308,4977,1955,"['EMPLOYEES At December 31, 1994, Southern National had approximately 3,609 full-time employees, an increase of 42% over the prior year originally-reported balance of 2,549.', '; Full-time-equivalent employees decreased by approximately 200 during 1994, a reflection of these factors.', '8 million higher than the same quarter in 1994 primarily because of severance pay and the buyout of employment contracts, deferred compensation and related fringe benefits.', '112, ""Employers\' Accounting for Postemployment Benefits"".', ""106 allowed employers to recognize the transition obligation immediately, subject to certain limitations, or on a delayed basis over the plan participants' future service periods."", 'Each non-employee director may elect to defer 0%, 50% or 100% of the annual retainer fee and meeting fees for each calendar year and apply that percentage toward the grant of options to purchase Southern National common stock.', 'The Plan covers employees retiring after January 1, 1993 who are eligible for participation in the Basic Plan and have at least ten years of service.', ""Southern National matches 100% of each employee's contributions, up to a maximum of 6% of the employee's salary.""]"
287,287,0000004977-00-000011,/Archives/edgar/data/4977/0000004977-00-000011-index.html,3/27/2000,https://www.sec.gov/Archives/edgar/data/4977/000000497700000011/0000004977-00-000011.txt,AFL,AFL_2000-03-27_0000004977-00-000011.txt,AFL,AFLAC Inc,reports,Financials,Life & Health Insurance,"Columbus, Georgia",36308,4977,1955,[]
288,288,0000004977-99-000010,/Archives/edgar/data/4977/0000004977-99-000010-index.html,3/26/1999,https://www.sec.gov/Archives/edgar/data/4977/000000497799000010/0000004977-99-000010.txt,AFL,AFL_1999-03-26_0000004977-99-000010.txt,AFL,AFLAC Inc,reports,Financials,Life & Health Insurance,"Columbus, Georgia",36308,4977,1955,"['With approximately 13,900 employees in more than 30 countries who serve clients in over 100 countries across the globe, BlackRock provides a broad range of investment, risk management and technology services to institutional and retail clients worldwide.', 'Employees  At December 31, 2017, BlackRock had a total of approximately 13,900 employees, including approximately 6,800 located in offices outside the United States.', 'With approximately 13,900 employees in more than 30 countries, BlackRock provides a broad range of investment, risk management and technology services to institutional and retail clients worldwide.', 'Expense increased $634 million, or 10%, from 2016, driven primarily by higher employee compensation and benefits expense, higher volume-related expense, and higher general and administration expense, partially offset by a restructuring charge recorded in 2016.', 'Pursuant to the BlackRock, Inc. Second Amended and Restated 1999 Stock Award and Incentive Plan (the ""Award Plan""), options to purchase shares of the Company\'s common stock at an exercise price not less than the market value of BlackRock\'s common stock on the date of grant in the form of stock options, restricted stock or RSUs may be granted to employees and nonemployee directors.', 'The total grant-date fair market value of RSUs/restricted stock granted to employees during 2017, 2016 and 2015 was $421 million, $446 million and $473 million, respectively.', 'In January 2018, the Company granted under the Award Plan    |    |  527,337 RSUs or shares of restricted stock to employees as part of annual incentive compensation that vest ratably over three years from the date of grant; and      ---|---|---        |    |  209,201 RSUs or shares of restricted stock to employees that cliff vest 100% on January 31, 2021.', 'In the first quarter of 2017, 2016 and 2015, the Company granted 294,584, 375,242, and 262,847, respectively, performance-based RSUs to certain employees that cliff vest 100% on January 31, 2020, 2019, and 2018 respectively.', 'The total grant-date fair market value of performance-based RSUs granted to employees during 2017 was $111 million.', 'In January 2018, the Company granted 199,068 performance-based RSUs to certain employees that cliff vest 100% on January 31, 2021.', 'The Company adopted a Voluntary Deferred Compensation Plan (""VDCP"") that allows eligible employees in the United States to elect to defer between 1% and 100% of their annual cash incentive compensation.']"
289,289,0000004977-98-000006,/Archives/edgar/data/4977/0000004977-98-000006-index.html,3/26/1998,https://www.sec.gov/Archives/edgar/data/4977/000000497798000006/0000004977-98-000006.txt,AFL,AFL_1998-03-26_0000004977-98-000006.txt,AFL,AFLAC Inc,reports,Financials,Life & Health Insurance,"Columbus, Georgia",36308,4977,1955,"['With employees in more than 30 countries who serve clients in over 100 countries across the globe, BlackRock provides a broad range of investment and risk management services to institutional and retail clients worldwide.', 'Employees  At December 31, 2016, BlackRock had a total of approximately 13,000 employees, including approximately 6,300 located in offices outside the United States.', 'With approximately 13,000 employees in more than 30 countries, BlackRock provides a broad range of investment and risk management services to institutional and retail clients worldwide.', 'Pursuant to the BlackRock, Inc. Second Amended and Restated 1999 Stock Award and Incentive Plan (the ""Award Plan""), options to purchase shares of the Company\'s common stock at an exercise price not less than the market value of BlackRock\'s common stock on the date of grant in the form of stock options, restricted stock or RSUs may be granted to employees and nonemployee directors.', 'The total fair market value of RSUs/restricted stock granted to employees during 2016, 2015 and 2014 was $446 million, $473 million and $472 million, respectively.', 'In January 2017, the Company granted under the Award Plan    |    |  699,991 RSUs or shares of restricted stock to employees as part of annual incentive compensation that vest ratably over three years from the date of grant; and      ---|---|---        |    |  277,313 RSUs or shares of restricted stock to employees that cliff vest 100% on January 31, 2020.', 'In the first quarter of 2016 and 2015, the Company granted 375,242 and 262,847, respectively, performance-based RSUs to certain employees that cliff vest 100% on January 31, 2019 and 2018, respectively.', 'The total grant-date fair market value of performance-based RSUs granted to employees during 2016 was $111 million.', 'In January 2017, the Company granted 293,385 performance-based RSUs to certain employees that cliff vest 100% on January 31, 2020.', 'Stock option grants were made to certain employees pursuant to the Award Plan in 1999 through 2007.', 'The Company adopted a Voluntary Deferred Compensation Plan (""VDCP"") that allows eligible employees in the United States to elect to defer between 1% and 100% of their annual cash incentive compensation.']"
290,290,0000004977-97-000009,/Archives/edgar/data/4977/0000004977-97-000009-index.html,3/26/1997,https://www.sec.gov/Archives/edgar/data/4977/000000497797000009/0000004977-97-000009.txt,AFL,AFL_1997-03-26_0000004977-97-000009.txt,AFL,AFLAC Inc,reports,Financials,Life & Health Insurance,"Columbus, Georgia",36308,4977,1955,"['With employees in more than 30 countries who serve clients in over 100 countries across the globe, BlackRock provides a broad range of investment and risk management services to institutional and retail clients worldwide.', 'Employees  At December 31, 2015, BlackRock had a total of approximately 13,000 employees, including approximately 6,200 located in offices outside the United States.', 'Consistent with our commitment to continually expand and enhance our talent base to support our clients, we added approximately 800 employees during the year, including in strategic focus areas.', 'The new rules, to which U.S. MMFs must conform by October 2016, require institutional prime and institutional municipal MMFs to employ a floating net asset value per share method of pricing, which allows the daily share prices of these funds to fluctuate along with changes in the market-based value of fund assets.', 'The new rules, to which U.S. MMFs must conform by October 2016, require institutional prime and institutional municipal MMFs to employ a floating net asset value per share method of pricing, which allows the daily share prices of these funds to fluctuate along with changes in the market-based value of fund assets.', 'With approximately 13,000 employees in more than 30 countries, BlackRock provides a broad range of investment and risk management services to institutional and retail clients worldwide.', 'Pursuant to the BlackRock, Inc. Second Amended and Restated 1999 Stock Award and Incentive Plan (the ""Award Plan""), options to purchase shares of the Company\'s common stock at an exercise price not less than the market value of BlackRock\'s common stock on the date of grant in the form of stock options, restricted stock or RSUs may be granted to employees and nonemployee directors.', 'The total fair market value of RSUs/restricted stock granted to employees during 2015, 2014 and 2013 was $473 million, $472 million and $390 million, respectively.', 'In January 2016, the Company granted under the Award Plan    |    |  1,030,964 RSUs or shares of restricted stock to employees as part of annual incentive compensation that vest ratably over three years from the date of grant; and      ---|---|---        |    |  303,587 RSUs or shares of restricted stock to employees that cliff vest 100% on January 31, 2019.', 'In January 2015, the Company granted 262,847 performance-based RSUs to certain employees that cliff vest 100% on January 31, 2018.', 'In January 2016, the Company granted 375,242 performance-based RSUs to certain employees that cliff vest 100% on January 31, 2019.', 'Stock option grants were made to certain employees pursuant to the Award Plan in 1999 through 2007.', 'The Company adopted a Voluntary Deferred Compensation Plan (""VDCP"") that allows eligible employees in the United States to elect to defer between 1% and 100% of their annual cash incentive compensation.']"
291,291,0000004977-96-000006,/Archives/edgar/data/4977/0000004977-96-000006-index.html,3/26/1996,https://www.sec.gov/Archives/edgar/data/4977/000000497796000006/0000004977-96-000006.txt,AFL,AFL_1996-03-26_0000004977-96-000006.txt,AFL,AFLAC Inc,reports,Financials,Life & Health Insurance,"Columbus, Georgia",36308,4977,1955,"['With employees in more than 30 countries who serve clients in over 100 countries across the globe, BlackRock provides a broad range of investment and risk management services to institutional and retail clients worldwide.', '**EMPLOYEES**  At December 31, 2014, BlackRock had a total of approximately 12,200 employees, including approximately 5,800 located in offices outside the United States.', 'Consistent with our commitment to continually expand and enhance our talent base to support our clients, we added approximately 800 employees during the year, including in strategic focus areas.', '**SEC Enforcement Matter**  In June 2012, BlackRock Advisors, LLC (\x93BlackRock Advisors\x94), a subsidiary of BlackRock, announced that its then-employee Daniel J. Rice III would, among other things, no longer serve as a portfolio manager for the BlackRock Energy & Resources Portfolio in order to address any perception of a potential conflict of interest as a result of his personal investments and involvement in a family business, Rice Energy LP and related entities.', 'With approximately 12,200 employees in more than 30 countries, BlackRock provides a broad range of investment and risk management services to institutional and retail clients worldwide.', '_** Pursuant to the BlackRock, Inc. 1999 Stock Award and Incentive Plan (the  \x93Award Plan\x94), options to purchase shares of the Company\x92s common stock at an exercise price not less than the market value of BlackRock\x92s common stock on the date of grant in the form of stock options, restricted stock or RSUs may be granted to employees and nonemployee directors.', 'The total fair market value of RSUs granted to employees during 2014, 2013 and 2012 was $472 million, $390 million and $348 million, respectively.', 'In January 2015, the Company granted under the Award Plan      | \x95 |   | 952,329 RSUs to employees as part of annual incentive compensation that vest ratably over three years from the date of grant;   ---|---|---|---          | \x95 |   | 303,999 RSUs to employees that cliff vest 100% on January 31, 2018; and   ---|---|---|---          | \x95 |   | 262,847 RSUs to employees that cliff vest 100% on January 31, 2018.', '_** Stock option grants were made to certain employees pursuant to the Award Plan in 1999 through 2007.']"
292,292,0000004977-95-000006,/Archives/edgar/data/4977/0000004977-95-000006-index.html,3/28/1995,https://www.sec.gov/Archives/edgar/data/4977/000000497795000006/0000004977-95-000006.txt,AFL,AFL_1995-03-28_0000004977-95-000006.txt,AFL,AFLAC Inc,reports,Financials,Life & Health Insurance,"Columbus, Georgia",36308,4977,1955,"['Business  **OVERVIEW**  BlackRock, Inc. (NYSE: BLK; together, with its subsidiaries, unless the context otherwise indicates, \x93BlackRock\x94 or the \x93Company\x94) is the world\x92s largest publicly traded investment management firm with employees in more than 30 countries who serve clients in over 100 countries across the globe.', 'Prior to the transfer in 2008 to a third party, these employees were retained on Metric\x92s payroll when certain properties were acquired by Realty\x92s clients.', '**EMPLOYEES**  At December 31, 2013, BlackRock had a total of approximately 11,400 employees, including approximately 5,400 located in offices outside the United States.', 'Consistent with our commitment to continually expand and enhance our talent base to support our clients, we added approximately 900 employees during the year, including in strategic focus areas.', 'Expenses decreased $19 million to $5,813 million from 2011, primarily reflecting a reduction in general and administration expenses, amortization of deferred sales commissions and distribution and servicing costs, partially offset by higher employee compensation and benefits and direct fund expenses.', 'The Company applies ASC 718-10, _Compensation \x96 Stock Compensation _(\x93ASC 718-10\x94), which establishes standards for the accounting of transactions in which an entity obtains employee services in share-based payment transactions.', '_** Pursuant to the BlackRock, Inc. 1999 Stock Award and Incentive Plan (the  \x93Award Plan\x94), options to purchase shares of the Company\x92s common stock at an exercise price not less than the market value of BlackRock\x92s common stock on the date of grant in the form of stock options, restricted stock or RSUs may be granted to employees and non-employee directors.', 'The total fair market value of RSUs granted to employees during 2013, 2012 and 2011 was $390 million, $348 million and $477 million, respectively.', 'The awards granted under the Award Plan primarily related to the following:  **__2011_ _**      | \x95 |   | 1,594,259 RSUs to employees as part of annual incentive compensation that vest ratably over three years from the date of grant; and   ---|---|---|---          | \x95 |   | 609,733 RSUs to employees that cliff vest 100% on January 31, 2014.', '---|---|---|---      **__2012_ _**      | \x95 |   | 1,365,691 RSUs to employees as part of annual incentive compensation that vest ratably over three years from the date of grant; and   ---|---|---|---          | \x95 |   | 418,038 RSUs to employees that cliff vest 100% on January 31, 2015.', '---|---|---|---      **__2013_ _**      | \x95 |   | 1,172,381 RSUs to employees as part of annual incentive compensation that vest ratably over three years from the date of grant; and   ---|---|---|---          | \x95 |   | 370,812 RSUs to employees that cliff vest 100% on January 31, 2016.', '**__2014_ _**  In January 2014, the Company granted the following awards under the Award Plan:      | \x95 |   | 1,022,295 RSUs to employees as part of annual incentive compensation that vest ratably over three years from the date of grant; and   ---|---|---|---          | \x95 |   | 287,963 RSUs to employees that cliff vest 100% on January 31, 2017.', '_** Stock option grants were made to certain employees pursuant to the Award Plan in 1999 through 2007.', 'In accordance with ASC 718-10, _Compensation \x96Stock Compensation,_ the Company does not record compensation expense related to employees purchasing shares under the ESPP.']"
293,293,0000004977-94-000006,/Archives/edgar/data/4977/0000004977-94-000006-index.html,3/30/1994,https://www.sec.gov/Archives/edgar/data/4977/000000497794000006/0000004977-94-000006.txt,AFL,AFL_1994-03-30_0000004977-94-000006.txt,AFL,AFLAC Inc,reports,Financials,Life & Health Insurance,"Columbus, Georgia",36308,4977,1955,"['** | **BUSINESS**   ---|---      **Overview**  BlackRock, Inc. (NYSE: BLK; \x93BlackRock\x94 or the \x93Company\x94) is the world\x92s largest publicly traded investment management firm with employees in 30 countries that serve clients in over 100 countries across the globe.', 'Prior to the transfer in 2008 to a third party, these employees were retained on Metric\x92s payroll when certain properties were acquired by Realty\x92s clients.', '**Employees**  At December 31, 2012, BlackRock had a total of approximately 10,500 employees, including approximately 4,800 located in offices outside the United States.', 'Consistent with our commitment to continually expand and enhance our talent base to support our clients, we added approximately 400 employees during the year, including in strategic focus areas such as business operations, Aladdin applications development, _iShares_ , alternatives, institutional sales and Asia.', 'The Company applies ASC 718-10, _Compensation \x96 Stock Compensation _(\x93ASC 718-10\x94), which establishes standards for the accounting of transactions in which an entity obtains employee services in share-based payment transactions.', '_** Pursuant to the BlackRock, Inc. 1999 Stock Award and Incentive Plan (the  \x93Award Plan\x94), options to purchase shares of the Company\x92s common stock at an exercise price not less than the market value of BlackRock\x92s common stock on  the date of grant in the form of stock options, restricted stock or RSUs may be granted to employees and non-employee directors.', 'The total fair market value of RSUs granted to employees during 2010 and 2011 was $751 million and $477 million, respectively.', 'Stock-Based Compensation (continued)**    The awards granted under the Award Plan primarily related to the following:  **__2010_ _**      | \x95 |   |  846,884 RSUs to employees as part of annual incentive compensation that vest ratably over three years from the date of grant;      ---|---|---|---          | \x95 |   |  455,288 RSUs to employees that cliff vested on January 31, 2012, the end of the service condition, as BlackRock had actual GAAP EPS in excess of $6.', 'The RSUs may not be sold before the one-year anniversary of the vesting date;      ---|---|---|---          | \x95 |   |  1,497,222 RSUs to employees that vest 50% on both January 31, 2013 and 2014, the end of the service condition, as BlackRock had actual GAAP EPS in excess of $6.', '13 in 2010; and      ---|---|---|---          | \x95 |   |  124,575 shares of restricted common stock to employees that vested in tranches on January 31, 2010, 2011 and 2012.', '---|---|---|---      **__2011_ _**      | \x95 |   |  1,594,259 RSUs to employees as part of annual incentive compensation that vest ratably over three years from the date of grant; and      ---|---|---|---          | \x95 |   |  609,733 RSUs to employees that cliff vest 100% on January 31, 2014.', '---|---|---|---      **__2012_ _**      | \x95 |   |  1,365,691 RSUs to employees as part of annual incentive compensation that vest ratably over three years from the date of grant; and      ---|---|---|---          | \x95 |   |  418,038 RSUs to employees that cliff vest 100% on January 31, 2015.', '**__2013_ _**  In January 2013, the Company granted the following awards under the Award Plan:      | \x95 |   |  1,172,381 RSUs to employees as part of annual incentive compensation that vest ratably over three years from the date of grant; and      ---|---|---|---          | \x95 |   |  370,812 RSUs to employees that cliff vest 100% on January 31, 2016.', '_** Stock option grants were made to certain employees pursuant to the Award Plan in 1999 through 2007.', 'In accordance with ASC 718-10, _Compensation \x96Stock Compensation,_ __the Company does not record compensation expense related to employees purchasing shares under the ESPP.', 'Prior to January 1, 2011, employee contributions of up to 6% of eligible compensation, as defined by the plan and subject to IRC limitations, were matched by the Company at 50%.', 'Reimbursements amounted to 50% of the total amount of awards to former MLIM employees between $100 million and $200 million.', 'Through January 2007, the Company had issued total eligible incentive compensation to qualified employees in excess of  $200 million.']"
545,545,0000899051-18-000007,/Archives/edgar/data/899051/000089905118000007/0000899051-18-000007-index.htm,2/26/2018,https://www.sec.gov/Archives/edgar/data/899051/000089905118000007/0000899051-18-000007.txt,ALL,ALL_2018-02-26_0000899051-18-000007.txt,ALL,Allstate Corp,reports,Financials,Property & Casualty Insurance,"Northfield Township, Illinois",34893,899051,1931,"['As of February 1, 2014, the Company employed 1,063 persons.', ""We currently have an agreement with Mr. Taranto to serve as a non-employee Director and Chairman of the Board through December 31, 2016, subject to Mr. Taranto's annual election to the Board by its shareholders during its Annual General Meetings that occur over the term of the agreement."", 'We have employment contracts with Mr. Addesso, Mr. Doucette and Mr. Mukherjee, which have been filed with the SEC and provide for terms of employment ending on December 31, 2016 for Mr. Addesso and September 1, 2016 for Mr. Doucette and Mr. Mukherjee.', 'Currently, all four of our Bermuda-based professional employees who require work permits have been granted permits by the Bermuda government that expire at various times between February 2015 and February 2017.', 'The Company has an employment contract with Mr. de Saram, which was filed with the SEC and provides for term of employment ending on November 1, 2014.', 'The increase in other underwriting expenses for 2012 compared to 2011 was mainly due to higher share-based compensation expenses and employee benefit plan expenses.', '9  |  |  Everest Re Group, Ltd. 2010 Stock Incentive Plan for employees is incorporated herein by reference to Exhibit 10.', '14  |  |  Employment Agreement between Everest Global Services, Inc., Everest Reinsurance Holdings, Inc. and Joseph V. Taranto, dated January 1, 2011, This employment supersedes the prior agreement between registrant and Joseph V. Taranto dated March 25, 2011.', 'The Company maintains both qualified and non-qualified defined benefit pension plans for its U.S. employees employed prior to April 1, 2010.', ""In addition, effective for new hires (and rehires) on or after April 1, 2010, the Company will contribute between 3% and 8% of an employee's earnings for each payroll period based on the employee's age."", ""The following table presents the Company's incurred expenses related to these plans for the periods indicated:  |  |  Years Ended December 31,  |   ---|---|---|---      (Dollars in thousands)  |  |  2013  |  |  |  2012  |  |  |  2011  |      Incurred expenses  |  | $ | 3,903 |  |  | $ | 3,209 |  |  | $ | 2,062 |      In addition, the Company maintains several defined contribution pension plans covering non-U.S. employees."", 'The Company sponsors a Retiree Health Plan for employees employed prior to April 1, 2010.', 'In addition, the Company has awarded options to non-employee directors in Board actions in 2001, 2000 and 1999.', 'Under the 2010 Employee Plan, 4,000,000 common shares have been authorized to be granted as non-qualified share options, incentive share options, share appreciation rights or restricted share and share awards to officers and key employees of the Company.', 'Through December 31, 2013, only non-qualified share options and restricted share awards had been granted under the employee plans.', 'Under the 2009 Director Plan, 37,439 common shares have been authorized to be granted as share options or restricted share awards to non-employee directors of the Company.', 'Under the 2003 Director Plan, 500,000 common shares      F-44  * * *  have been authorized to be granted as share options or share awards to non- employee directors of the Company.', 'Board actions in 2001, 2000 and 1999, which were not approved by shareholders, awarded options to non-employee directors.', 'Under Board actions in 2001, 2000 and 1999; 40,000, 30,000 and 26,000 common shares, respectively, were granted as share options to non-employee directors of the Company.', 'Options and restricted shares granted under the 2010 Employee Plan, the 2002 Employee Plan and the 1995 Employee Plan vest at the earliest of 20% per year over five years or in accordance with any applicable employment agreement.', ""In addition to the 2010 Employee Plan, the 2002 Employee Plan, the 1995 Employee Plan, the 2009 Director Plan, the 2003 Director Plan and the 1995 Director Plan, Group issued 586 common shares in 2013, 518 common shares in 2012 and 668 common shares in 2011 to the Company's non-employee directors as compensation for their service as directors."", 'Since its 1995 initial public offering, the Company has issued to certain key employees of the Company 1,535,703 restricted common shares, of which 187,687 restricted shares have been cancelled.', 'The Company has issued to non-employee directors of the Company 85,519 restricted common shares, of which no restricted shares have been cancelled.', 'The Company acquired 74,175, 79,086 and 201,287 common shares at a cost of $9,313  F-47  * * *  thousand, $8,322 thousand and $17,951 thousand in 2013, 2012 and 2011, respectively, from employees and non-employee directors who chose to pay the option grant price with shares.']"
